{
  "$schema": "https://json-schema.org/draft/2020-12/schema",
  "title": "Evidence v1",
  "type": "object",
  "additionalProperties": false,
  "properties": {
    "schema_version": {
      "const": "1.0"
    },
    "evidence_id": {
      "type": "string",
      "minLength": 1,
      "maxLength": 128,
      "pattern": "^[A-Za-z0-9_.:-]+$"
    },
    "run_id": {
      "type": "string",
      "minLength": 1,
      "maxLength": 128,
      "pattern": "^[A-Za-z0-9_.:-]+$"
    },
    "instrument_id": {
      "type": "string",
      "minLength": 1,
      "maxLength": 128,
      "pattern": "^[A-Za-z0-9_.:-]+$"
    },
    "source_id": {
      "type": "string",
      "minLength": 1,
      "maxLength": 128,
      "pattern": "^[A-Za-z0-9_.:-]+$"
    },
    "title": {
      "type": "string",
      "minLength": 1,
      "maxLength": 300
    },
    "source_url": {
      "type": "string",
      "format": "uri",
      "maxLength": 2048
    },
    "source_kind": {
      "enum": [
        "filing",
        "financials",
        "market",
        "news",
        "fixture",
        "user_report",
        "web_article"
      ]
    },
    "published_at": {
      "type": "string",
      "format": "date-time"
    },
    "available_at": {
      "type": "string",
      "format": "date-time"
    },
    "retrieved_at": {
      "type": "string",
      "format": "date-time"
    },
    "content_hash": {
      "type": "string",
      "pattern": "^[a-f0-9]{64}$"
    },
    "data_version": {
      "type": "string",
      "minLength": 1,
      "maxLength": 128,
      "pattern": "^[A-Za-z0-9_.:-]+$"
    },
    "mode": {
      "enum": [
        "fixture",
        "live"
      ]
    },
    "locator": {
      "type": "string",
      "minLength": 1,
      "maxLength": 300
    },
    "text": {
      "type": "string",
      "minLength": 1,
      "maxLength": 20000
    },
    "metrics": {
      "type": "array",
      "items": {
        "type": "object",
        "additionalProperties": false,
        "properties": {
          "metric": {
            "type": "string",
            "minLength": 1,
            "maxLength": 128,
            "pattern": "^[A-Za-z0-9_.:-]+$"
          },
          "period_start": {
            "type": "string",
            "format": "date"
          },
          "period_end": {
            "type": "string",
            "format": "date"
          },
          "value": {
            "type": "string",
            "pattern": "^-?(0|[1-9][0-9]*)(\\.[0-9]+)?$"
          },
          "unit": {
            "type": "string",
            "minLength": 1,
            "maxLength": 128,
            "pattern": "^[A-Za-z0-9_.:-]+$"
          },
          "value_type": {
            "enum": [
              "actual",
              "estimate"
            ]
          }
        },
        "required": [
          "metric",
          "period_start",
          "period_end",
          "value",
          "unit",
          "value_type"
        ]
      },
      "maxItems": 100
    },
    "source_grade": {
      "type": "string",
      "enum": [
        "official_filing",
        "structured_data",
        "user_report",
        "external_web",
        "fixture"
      ]
    },
    "verification_status": {
      "type": "string",
      "enum": [
        "independent_verified",
        "reported_only"
      ]
    }
  },
  "required": [
    "schema_version",
    "evidence_id",
    "run_id",
    "instrument_id",
    "source_id",
    "title",
    "source_url",
    "source_kind",
    "published_at",
    "available_at",
    "retrieved_at",
    "content_hash",
    "data_version",
    "mode",
    "locator",
    "text",
    "metrics"
  ]
}
